<?xml version="1.0" encoding="UTF-8"?>
<!-- XML Sample Message of message hierarchy                                          -->
<!-- Message:             ADC INV Location v1.0 Rev. 2                                -->
<!-- Transaction:         AA - Audit Data Collection Rev. 235                         -->
<!-- Datamodel:           Audit Data Collection Datamodel, version HEAD Rev. 312      -->
<!-- XML tagset used:     AdcsML                                                      -->
<!-- Generated at:        23-01-2021 19:09:21                                         -->
<!-- Generated using:     EC-Design 2.5.0 (http://www.ec-design.nl)                   -->
<!-- Generated by:        Jan Vrijenhoek (Digitect)                                   -->
<!-- Organisation:        Digitect B.V. (Digitect)                                    -->
<!-- NOTE:    This sample message was generated automatically: manual modifications will be lost -->
<AdcInvLocation xsi:schemaLocation="http://schemas.iso.org/AdcsML/Messages/AdcInvLocation-v1 AdcInvLocation-v1.0.xsd"
		xmlns="http://schemas.iso.org/AdcsML/Messages/AdcInvLocation-v1"
		xmlns:xsi="http://www.w3.org/2001/XMLSchema-instance">
	<InvLct>
		<LctId>L001</LctId>
		<LctCd>PLANT001</LctCd>
		<ParLctId>L001</ParLctId>
		<LctDscr>Plant 001</LctDscr>
		<LctTyp>Warehouse</LctTyp>
		<InvOrgCd>BS001</InvOrgCd>
		<LctActiveFlag>true</LctActiveFlag>
		<BusSgX>BS001</BusSgX>
		<PhysAdr>
			<StreetAdr1>42th Street</StreetAdr1>
			<StreetAdr2>Plant 2</StreetAdr2>
			<CityNm>New York</CityNm>
			<StatePrvncCd>NY</StatePrvncCd>
			<PostalCd>NY 1234</PostalCd>
			<CntryCd>US</CntryCd>
		</PhysAdr>
	</InvLct>
</AdcInvLocation>
